{
  "brief_id": "brief-c86e2622bdd5",
  "catalog_record": {
    "canonical_url": "https://persiantoolbox.ir/topics/seo-tools",
    "title": "ابزارهای سئو — 15 ابزار رایگان فارسی | جعبه ابزار فارسی",
    "summary": "ابزارهای سئو: پیش‌نمایش اسنیپت گوگل | Google SERP Snippet Preview، مولد متا دیسکریپشن فارسی | Persian Meta Description Generator، تحلیل عنوان سئو | SEO Title Analyzer، بررسی ساختار H1 تا H6 | Heading Structure Checker، بررسی Canonical | Canonical URL Checker و 10 ابزار دیگر. تمام پردازش‌ها محلی و بدون ثبت‌نام.",
    "category": "tool-demo",
    "source_id": "topics-seo-tools",
    "source_hash": "7a3c7d7a1635eeddd71c3beb596661610f0f986bfd1ba73fdf4e8ee1f977bbfd",
    "crawled_at": "2026-07-31T17:21:58.158330+00:00",
    "claims": [
      {
        "text": "DOCTYPE html><html lang=\"fa\" dir=\"rtl\"><head><meta charSet=\"utf-8\"/><meta name=\"viewport\" content=\"width=device-width, initial-scale=1\"/><link rel=\"stylesheet\" href=\"/_next/static/chunks/21ebrt1uadu1m",
        "source_id": "topics-seo-tools",
        "verifiable": true,
        "confidence": 0.6,
        "verdict": "UNVERIFIED",
        "evidence_url": null
      },
      {
        "text": "css\" nonce=\"d2457375-bf53-4b1e-bdd1-0f64431bd80f\" data-precedence=\"next\"/><link rel=\"preload\" as=\"script\" fetchPriority=\"low\" nonce=\"d2457375-bf53-4b1e-bdd1-0f64431bd80f\" href=\"/_next/static/chunks/0-",
        "source_id": "topics-seo-tools",
        "verifiable": true,
        "confidence": 0.6,
        "verdict": "UNVERIFIED",
        "evidence_url": null
      },
      {
        "text": "js\"/><script src=\"/_next/static/chunks/0-52qqhjy766e",
        "source_id": "topics-seo-tools",
        "verifiable": true,
        "confidence": 0.6,
        "verdict": "UNVERIFIED",
        "evidence_url": null
      },
      {
        "text": "js\" async=\"\" nonce=\"d2457375-bf53-4b1e-bdd1-0f64431bd80f\"></script><script src=\"/_next/static/chunks/2njsu4p7tspr7",
        "source_id": "topics-seo-tools",
        "verifiable": true,
        "confidence": 0.6,
        "verdict": "UNVERIFIED",
        "evidence_url": null
      },
      {
        "text": "js\" async=\"\" nonce=\"d2457375-bf53-4b1e-bdd1-0f64431bd80f\"></script><script src=\"/_next/static/chunks/2lcsmgny2bh0o",
        "source_id": "topics-seo-tools",
        "verifiable": true,
        "confidence": 0.6,
        "verdict": "UNVERIFIED",
        "evidence_url": null
      },
      {
        "text": "js\" async=\"\" nonce=\"d2457375-bf53-4b1e-bdd1-0f64431bd80f\"></script><script src=\"/_next/static/chunks/1e0w62lynl1-m",
        "source_id": "topics-seo-tools",
        "verifiable": true,
        "confidence": 0.6,
        "verdict": "UNVERIFIED",
        "evidence_url": null
      },
      {
        "text": "js\" async=\"\" nonce=\"d2457375-bf53-4b1e-bdd1-0f64431bd80f\"></script><script src=\"/_next/static/chunks/turbopack-2setjja8lgbmv",
        "source_id": "topics-seo-tools",
        "verifiable": true,
        "confidence": 0.6,
        "verdict": "UNVERIFIED",
        "evidence_url": null
      },
      {
        "text": "js\" async=\"\" nonce=\"d2457375-bf53-4b1e-bdd1-0f64431bd80f\"></script><script src=\"/_next/static/chunks/10ise4fnrgqs0",
        "source_id": "topics-seo-tools",
        "verifiable": true,
        "confidence": 0.6,
        "verdict": "UNVERIFIED",
        "evidence_url": null
      },
      {
        "text": "js\" async=\"\" nonce=\"d2457375-bf53-4b1e-bdd1-0f64431bd80f\"></script><script src=\"/_next/static/chunks/0p06jnm5n7s2w",
        "source_id": "topics-seo-tools",
        "verifiable": true,
        "confidence": 0.6,
        "verdict": "UNVERIFIED",
        "evidence_url": null
      },
      {
        "text": "js\" async=\"\" nonce=\"d2457375-bf53-4b1e-bdd1-0f64431bd80f\"></script><script src=\"/_next/static/chunks/3d2x-w4y0eb9k",
        "source_id": "topics-seo-tools",
        "verifiable": true,
        "confidence": 0.6,
        "verdict": "UNVERIFIED",
        "evidence_url": null
      }
    ],
    "risk_tags": [
      "financial",
      "legal",
      "privacy"
    ],
    "http_metadata": {
      "status_code": 200,
      "content_type": "text/html; charset=utf-8",
      "content_length": 0,
      "last_modified": null,
      "etag": null
    },
    "verified_at": null,
    "expires_at": null,
    "meta": {
      "og:title": "ابزارهای سئو — 15 ابزار رایگان فارسی | جعبه ابزار فارسی",
      "og:description": "ابزارهای سئو: پیش‌نمایش اسنیپت گوگل | Google SERP Snippet Preview، مولد متا دیسکریپشن فارسی | Persian Meta Description Generator، تحلیل عنوان سئو | SEO Title Analyzer، بررسی ساختار H1 تا H6 | Heading Structure Checker، بررسی Canonical | Canonical URL Checker و 10 ابزار دیگر. تمام پردازش‌ها محلی و بدون ثبت‌نام.",
      "og:image": "https://persiantoolbox.ir/og-default.png",
      "og:type": "website"
    }
  },
  "audience": {
    "segment": "فریلنسرها",
    "pain_point": "وقت‌گیری کارهای ساده",
    "desire": "خودکارسازی"
  },
  "content_strategy": {
    "angle": "معرفی ابزارهای سئو — 15 ابزار رایگان فارسی | جعبه ابزار فارسی برای فریلنسرها",
    "hook_type": "direct",
    "template_type": "tool-demo"
  },
  "psychology_hypothesis": {
    "principle": "کمیابی",
    "expected_effect": "افزایش فوریت (فقط برای محتوای فصلی)"
  },
  "caption": {
    "primary": "دیگه نیازی به ابزارهای سئو: پیش‌نمایش اسنیپت گوگل | Google SERP  نیست\n\nابزارهای سئو: پیش‌نمایش اسنیپت گوگل | Google SERP Snippet Preview، مولد متا دیسکریپشن فارسی | Persian Meta Description Generator، تحلیل عنوان سئو | SEO Title Analyzer، بررسی ساختار H1 تا H6 | Heading \n\nهمین حالا امتحان کن 👇",
    "variants": {
      "direct_variant": "با این ابزار رایگان ابزارهای سئو — 15 ابزار رایگان فارسی | جعبه ابزار فارسی کارت رو سریع‌تر انجام بده\n\nابزارهای سئو: پیش‌نمایش اسنیپت گوگل | Google SERP Snippet Preview، مولد متا دیسکریپشن فارسی | Persian Meta Description Generator، تحلیل عنوان سئو | SEO Title Analyzer، بررسی ساختار H1 تا H6 | Heading \n\nهمین حالا امتحان کن 👇",
      "educational_variant": "آیا می‌دونستی می‌تونی ابزارهای سئو: پیش‌نمایش اسنیپت گوگل | Google SERP Snippet Preview، مولد متا دیسکریپشن فارسی | Persia رو رایگان انجام بدی؟\n\nابزارهای سئو: پیش‌نمایش اسنیپت گوگل | Google SERP Snippet Preview، مولد متا دیسکریپشن فارسی | Persian Meta Description Generator، تحلیل عنوان سئو | SEO Title Analyzer، بررسی ساختار H1 تا H6 | Heading \n\nهمین حالا امتحان کن 👇",
      "curiosity_variant": "این ابزار رایگان یه چیزی داره که بقیه ندارن\n\nابزارهای سئو: پیش‌نمایش اسنیپت گوگل | Google SERP Snippet Preview، مولد متا دیسکریپشن فارسی | Persian Meta Description Generator، تحلیل عنوان سئو | SEO Title Analyzer، بررسی ساختار H1 تا H6 | Heading \n\nرایگان امتحان کن",
      "problem-solution_variant": "وقتی ابزارهای سئو: پیش‌نمایش اسنیپت گوگل | Google SERP  داری، ابزارهای سئو — 15 ابزار رایگان فارسی | جعبه ابزار فارسی کمکت می‌کنه\n\nابزارهای سئو: پیش‌نمایش اسنیپت گوگل | Google SERP Snippet Preview، مولد متا دیسکریپشن فارسی | Persian Meta Description Generator، تحلیل عنوان سئو | SEO Title Analyzer، بررسی ساختار H1 تا H6 | Heading \n\nلینک در بیو",
      "before-after_variant": "قبل: ابزارهای سئو: پیش‌نمایش اسنیپت گوگل | Google SERP  | بعد: ابزارهای سئو: پیش‌نمایش اسنیپت گوگل | Google SERP Snippet Preview، مولد متا دیسکریپشن فارسی | Persia آسان\n\nابزارهای سئو: پیش‌نمایش اسنیپت گوگل | Google SERP Snippet Preview، مولد متا دیسکریپشن فارسی | Persian Meta Description Generator، تحلیل عنوان سئو | SEO Title Analyzer، بررسی ساختار H1 تا H6 | Heading \n\nسایت رو ببین 👇"
    },
    "alt_text": "تصویر پست ابزارهای سئو — 15 ابزار رایگان فارسی | جعبه ابزار فارسی — ابزارهای سئو: پیش‌نمایش اسنیپت گوگل | Google SERP Snippet Preview، مولد متا دیسکریپشن فارسی | Persia",
    "cta": "همین حالا امتحان کن 👇"
  },
  "art_direction": {
    "template": "tool-demo",
    "color_palette": {
      "primary": "#2563EB",
      "secondary": "#1E40AF",
      "accent": "#F59E0B",
      "background": "#FFFFFF",
      "text": "#1E293B"
    },
    "typography": {
      "heading_font": "Vazirmatn",
      "body_font": "Vazirmatn",
      "heading_size_px": 28,
      "body_size_px": 16
    },
    "layout_notes": "Template: tool-demo. RTL layout. Persian text prominent."
  },
  "risk_level": "HIGH",
  "risk_decision": "ESCALATE",
  "utm": {
    "source": "instagram",
    "medium": "social",
    "campaign": "content-factory-pilot",
    "content": "topics-seo-tools"
  },
  "created_at": "2026-07-31T17:22:06.681561+00:00",
  "version": 1
}