{
  "brief_id": "golden-e19892af36bd",
  "catalog_record": {
    "canonical_url": "https://persiantoolbox.ir/golden/golden-privacy-2",
    "title": "حریم خصوصی بدون سرور",
    "summary": "چرا بدون سرور مهم است",
    "category": "privacy",
    "source_id": "golden-privacy-2",
    "source_hash": "aaaaaaaaaaaaaaaaaaaaaaaaaaaaaaaaaaaaaaaaaaaaaaaaaaaaaaaaaaaaaaaa",
    "crawled_at": "2026-07-31T17:27:23.109645+00:00",
    "claims": [],
    "risk_tags": [
      "privacy"
    ],
    "http_metadata": {
      "status_code": 0,
      "content_type": "",
      "content_length": 0,
      "last_modified": null,
      "etag": null
    },
    "verified_at": null,
    "expires_at": null,
    "meta": {}
  },
  "audience": {
    "segment": "کاربران حساس",
    "pain_point": "نگرانی حریم خصوصی",
    "desire": "امنیت"
  },
  "content_strategy": {
    "angle": "حریم خصوصی بدون سرور",
    "hook_type": "curiosity",
    "template_type": "privacy-trust"
  },
  "psychology_hypothesis": {
    "principle": "تست",
    "expected_effect": "تست"
  },
  "caption": {
    "primary": "حریم خصوصی بدون سرور — چرا بدون سرور مهم است",
    "variants": {},
    "alt_text": "",
    "cta": "همین حالا امتحان کن"
  },
  "art_direction": {
    "template": "privacy-trust",
    "color_palette": {
      "primary": "#2563EB",
      "secondary": "#1E40AF",
      "accent": "#F59E0B",
      "background": "#FFFFFF",
      "text": "#1E293B"
    },
    "typography": {
      "heading_font": "Vazirmatn",
      "body_font": "Vazirmatn",
      "heading_size_px": 28,
      "body_size_px": 16
    },
    "layout_notes": ""
  },
  "risk_level": "HIGH",
  "risk_decision": "ESCALATE",
  "utm": {},
  "created_at": "2026-07-31T17:27:23.109653+00:00",
  "version": 1
}